{"schema_version":"grounded-task.v1","protocol":"worldeval-conversation/0.1.0","task_id":"task-1","revision":0,"conversation_id":"warehouse-chat-1","command_message_id":"message-1","source":{"observation_seq":4,"tick":12,"state_hash":"sha256:1111111111111111111111111111111111111111111111111111111111111111"},"intent_id":"pick_up","bindings":["binding-box"],"constraints":[{"constraint_id":"constraint-visible","level":"hard","kind":"target_must_remain_visible","binding_ids":["binding-box"],"parameters":{}}],"execution":{"action_profile":"semantic-grid-actions-v1","observation_profile":"semantic-grid-visible-v1","decision_profile":"dynamic-step-locked-v1","permitted_action_ids":["move_to","pick_up"],"mode":"agent_visible_action_plan_only","gameplay_authority":"environment_authority"},"state":"ready","task_hash":"sha256:59391519d3a385847df0b674a32c5f1ab9c105f4a8a985d4d08681146a23ae85"}
